{
  "schema_version": 1,
  "event_id": "b7d4e1a2-6c3f-4f0a-9a52-2e8c1d7f9b30",
  "user_id": "3f6c2b7e-9d1a-4c58-8e0b-5a1d7c4f2e91",
  "username": "priya.sharma",
  "first_name": "Priya",
  "last_name": "Sharma",
  "phone_number": "9876500012",
  "email": "priya.sharma@example.com",
  "created_at": "2026-09-20T09:15:30Z"
}
